,source,text,url
0,the new york times,"WASHINGTON -- Hours after he was sworn in as America's 45th president, Donald J. Trump and his wife, Melania, swayed together to a rendition of the Frank Sinatra classic ""My Way,"" as hundreds of their wealthiest and most influential supporters held aloft smartphones to capture the Trumps' first dance following the inauguration.

Serhiy Kivalov, a Ukrainian lawmaker known for pro-Russian initiatives, took photos of the dance, as well as of his coveted tickets and passes to the soiree where it took place, the Liberty Ball at the Walter E. Washington Convention Center, posting them on Facebook and declaring that ""it was an honor"" to attend.

He was one of at least a dozen Ukrainian political and business figures who made their way to Washington for the inauguration, several of whom attended the Liberty Ball. Most had more on their dance cards than just parties.

They attended meetings and orchestrated encounters at Trump International Hotel with influential Republican members of Congress and close allies of President Trump. Representing a range of views, including a contingent seen as sympathetic to Moscow, they positioned themselves as brokers who could help solve one of the thorniest foreign policy problems facing the new administration -- the ugly military stalemate between Russia and Ukraine and the tough sanctions imposed on Moscow following its seizure of Crimea.

The transition of power in Washington attracted officials and business executives from around the world seeking entree and influence with the new administration. While many parties and other gatherings during that period were open to anyone, packages for more exclusive events organized by Mr. Trump's presidential inaugural committee started at $25,000 for two tickets to one of the official black tie balls and other events, according to a brochure listing inaugural committee ""underwriter benefits.""

Evidence of the Ukrainians' presence eventually prompted interest from the special counsel, Robert S. Mueller III, as he investigated Russian interference in the 2016 election, and has spawned a number of related inquiries by federal prosecutors. The investigations are playing out against growing indications that some of the Ukrainians who came to Washington for the inaugural, or their allies, were promoting grand bargains, or ""peace"" plans, that aligned with Russia's interests, including by lifting sanctions.

Such a deal would not just have given the new administration additional flexibility to bring Moscow into American diplomatic efforts in the Middle East, but could also have eased the way for a cast of characters with ties to Mr. Trump -- some of whom in turn had ties to the Ukrainians who came to Washington -- to move ahead on business deals that had been complicated by the sanctions.

Federal prosecutors have asked witnesses about how some of the Ukrainians gained access to inauguration events, whom they met with while they were in the United States, and what they discussed -- including questions about various peace plan proposals -- according to people with direct knowledge of the questions and others who were briefed on the interviews.

As recently as last month, prosecutors were asking witnesses about illegal foreign lobbying related to Ukraine. Another subject of questions has been whether foreigners from Ukraine and other countries used straw donors to disguise donations to the inaugural committee. Federal law prohibits foreigners from contributing to an inaugural committee, although they can attend events if Americans buy the tickets.

Elements of the investigations have gotten new visibility in recent weeks.

Lawyers for Paul Manafort, the former Trump campaign chairman who was paid tens of millions of dollars over the last dozen years by Russia-aligned Ukrainian interests, inadvertently revealed on Tuesday that he had communicated about a Ukraine-Russia peace plan with a business associate believed to have ties to Russian intelligence.

The associate, Konstantin V. Kilimnik, is a Russian citizen who has been charged by Mr. Mueller with obstruction of justice for trying to shape the testimony of witnesses to the events that led to charges of illegal foreign lobbying against Mr. Manafort.

Mr. Kilimnik was said in the inadvertently disclosed portions of the court filing to have received political polling data from Mr. Manafort in 2016. Mr. Manafort relayed a request to have Mr. Kilimnik pass the polling data to two Ukrainian oligarchs who had arranged or provided financing for Russia-aligned Ukrainian political parties for which Mr. Manafort had worked. One of the oligarchs, Serhiy Lyovochkin, attended the Liberty Ball, according to one person familiar with the guest list and another who saw him there.

Last month, prosecutors made a move that was seen as signaling the continuing cooperation of Sam Patten, an American consultant who had worked with Mr. Kilimnik and Russia-aligned Ukrainians looking to build ties to the Trump administration.

Mr. Patten had pleaded guilty in late August to charges including funneling $50,000 in money from an unnamed foreigner who matched the description of Mr. Lyovochkin but was described in court papers only as ""a prominent Ukraine oligarch"" to buy tickets to exclusive Trump inauguration events for the oligarch, Mr. Kilimnik and someone described only as ""another Ukrainian.""

Other Ukrainians who came to Washington during the inauguration said prosecutors had been asking wide-ranging questions.

""I have been interrogated twice by the F.B.I. and Mr. Mueller,"" said Andrii V. Artemenko, who came to the inauguration as a Ukrainian member of Parliament bearing a peace proposal that was later criticized as pro-Russian.

Mr. Artemenko said he had testified before Mr. Mueller's grand jury last summer and had answered questions from the Mueller team ""about what is my purpose of this trip, how I can get there, and what I did, how I got invitations and tickets and stuff.""

On Capitol Hill, investigators from the House Oversight Committee, now under Democratic control, are looking into Michael T. Flynn, Mr. Trump's first national security adviser, who was a central player in the effort to build a new relationship with President Vladimir V. Putin of Russia.

How active a role Mr. Flynn played in the discussions about a peace plan for Ukraine is unclear, but congressional investigators have been pursuing whether he or his former business partners might have gained financially if the sanctions on Russia were ended.

The committee, whose chairman is Representative Elijah E. Cummings of Maryland, is continuing to pursue its investigation of Mr. Flynn's business dealings and ""his potential misuse of his public position when he was national security adviser,"" a committee spokeswoman said.

In 2017, a whistle-blower told committee investigators that Mr. Flynn had mentioned to a business associate around the time of the inauguration that the Russia sanctions would be ""ripped up"" as one of the administration's first acts. Mr. Flynn believed that ending the sanctions could allow a business project he had once participated in to move forward, according to the whistle-blower.

Mr. Flynn had been part of a business venture to partner with Russia to build nuclear power plants in the Middle East until June 2016, but after his direct involvement ended, he remained close with people involved in the project.

In a December 2017 letter to the Oversight Committee, an officer of the company that hired Mr. Flynn as an adviser on the project, ACU Strategic Partners, said that the allegations of the whistle-blower were ""false and unfounded.""

Mr. Flynn subsequently intersected with one of the Ukrainian efforts to resolve the problems with Russia.

Mr. Artemenko, the former Ukrainian lawmaker, said in an interview that he did not attend any inaugural balls or other events that required paid tickets. Instead, he said he watched Mr. Trump's inaugural address, which was free, and met with various Republicans to discuss his peace plan, which would have lifted sanctions against Russia and which he said had some support from the Kremlin.

Days after the inauguration, Mr. Artemenko traveled to New York to discuss his peace plan with Michael D. Cohen, who was then Mr. Trump's lawyer, and a former business partner of the president's, Felix H. Sater, who had helped Mr. Trump scout deals in Russia. Mr. Cohen subsequently hand-delivered the peace plan to Mr. Flynn a week before Mr. Flynn was forced to resign after being caught lying about his own discussion of sanctions with the Russian ambassador.

Within days of the inauguration, the White House made inquiries to the State Department and Congress about what might be required to ease the sanctions. Resetting relations with the Russian government and Mr. Putin had been central to Mr. Trump's foreign policy approach during the campaign, the transition and the first days of the new administration, and it is unclear what role, if any, the back-channel Ukrainian entreaties might have played.

The official inquiries about an abrupt policy shift set off alarms at the State Department and in Congress.

""I heard from various sources that there was a plan to summarily lift sanctions on Russia,"" said Daniel Fried, a veteran diplomat who stayed on for the first several weeks of the Trump administration as the State Department's coordinator for sanctions policy. ""I was approached by people who were nervous that the United States was about to do something irretrievably stupid.""

Several other officials, some of whom would speak only on the condition of anonymity, also recalled jarring questions from the new National Security Council under Mr. Flynn, including whether Ukraine was really part of Russia and whether Crimea wanted to be part of Russia.

Even among Republicans, the idea of easing sanctions found little support. ""If there's any country in the world that doesn't deserve sanctions relief, it's Russia,"" Senator Mitch McConnell, the majority leader, said in an interview with Politico a week after the inauguration.

By March 2017, the White House's sanctions relief trial balloon had wilted amid opposition from congressional leaders.

But that has not stopped the prosecutorial scrutiny of those pushing plans to lift the sanctions around the inauguration, and their roles in prospective business deals that might have benefited from the lifting of the sanctions.

Mr. Cohen has pleaded guilty to a number of charges, including lying to congressional investigators about negotiations to build a Trump skyscraper in Moscow. While Mr. Cohen had initially echoed Mr. Trump's claim that talks about the Moscow project had ended before the 2016 presidential campaign, Mr. Cohen admitted in his guilty plea that they extended into the summer of 2016.

By then, Russia was engaged in a surreptitious hacking and social media campaign to bolster Mr. Trump, who was publicly pressing for warmer relations with Russia, including signaling a willingness to consider lifting sanctions.

The sanctions posed a potential obstacle for the Trump Tower Moscow project, in which Mr. Sater, who is Russian-American, had positioned himself as a key player. Mr. Sater and Mr. Cohen discussed financing from two Russian banks, VTB and GenBank, but the sanctions prohibited American citizens and companies from doing business with either of them, according to reporting by The New York Times and BuzzFeed.

Another prominent businessman who had worked with Mr. Trump years earlier to try to erect a Trump building in Moscow, the Ukrainian-Russian developer Pavel Fuks, also was in Washington for the inauguration.

Mr. Fuks, who has since fallen out of favor in Moscow and was placed under sanctions by the Kremlin, stayed at Trump International Hotel, and spent time with Vitaliy Khomutynnik, a businessman and parliamentarian who had been a member of the Russia-aligned party for which Mr. Manafort worked. Mr. Fuks and Mr. Khomutynnik talked with Representatives Kevin McCarthy and Ed Royce, both influential California Republicans at the time.

Mr. Khomutynnik's party posted photos of him with the congressmen on Facebook, and suggested that he extracted assurances that American-Ukrainian relations would grow stronger under Mr. Trump, without detailing any specific policy discussions.

Mr. McCarthy's office said that the encounter was random, and that the conversation was brief and perfunctory, and noted that Mr. McCarthy has supported sanctions against Russia.

In Ukraine, a parliamentarian affiliated with the president, Petro Poroshenko, who is generally regarded as pro-Western, accused rival politicians of paying as much as $200,000 for inaugural tickets.

Mr. Kivalov, the Ukrainian lawmaker who posted photos of the Trumps' dance, did not respond to requests for comment about how he got his tickets to the Liberty Ball. Borislav Bereza, a Ukrainian lawmaker who posted a photo of himself in a tuxedo at the ball, said he got his tickets free from someone ""connected to Illinois,"" though he said, ""I don't remember for sure.""

He attributed the claims about Ukrainians' paying for tickets to jealousy from those who were not invited, and in a Facebook post he characterized the ball as ""a place where, over a glass of champagne, you are introduced to people who have influence in the new administration of the White House. These are the traditions of the United States.""",https://www.nytimes.com/2019/01/10/us/politics/ukraine-donald-trump-inauguration.html
1,the new york times,"LANSING, Mich. -- On both sides of Lake Michigan this month, Republican-dominated legislatures pushed forward measures aimed at hamstringing Democrats who will take over their statehouses in January. On the Wisconsin side, Gov. Scott Walker shrugged at accusations of dirty politics and partisan overreach and signed them into law.

In Michigan, all eyes are on Gov. Rick Snyder.

A term-limited Republican, Governor Snyder is hardly beloved by the legislature's Democrats. But as a lame-duck legislative session draws to a close this week, he has become their best hope to halt an unprecedented effort by Republican lawmakers to lock their priorities into place before Democrats take over the governor's office and other major state offices next month.

With the session set to end on Thursday, Republicans already have sent legislation to Mr. Snyder that would make it much more difficult for executive-branch agencies to issue regulations that are stricter than federal ones.

Michigan Republicans are expected to take up bills this week to strip campaign-finance regulation authority from the new Democratic secretary of state, give the legislature an unchallenged voice in lawsuits overseen by the new Democratic attorney general, and prevent Democratic officials from forcing nonprofit political advocacy groups to disclose who bankrolls their campaigns.

In a state whose political traditions might be called radically moderate -- George Romney and William Milliken are famous examples of Republican governors who bent over backward in search of compromises -- the legislature's moves are unsettling to some members of both parties.

Some Democrats say it is no accident that the three state offices targeted by the male-dominated legislature will all be occupied by women in January. The state's incoming Democratic governor, Gretchen Whitmer, is a former Senate minority leader; the new attorney general, Dana Nessel, is a Detroit lawyer and LGBTQ activist. Jocelyn Benson, an associate law professor, will become secretary of state.

Republican leaders in the House and Senate, who did not respond to requests for interviews, have called the chambers' actions politics as usual, albeit bare-knuckled. Yet even some veteran Republicans say the moves, which echo similar power plays by Republican lawmakers in Wisconsin and North Carolina, shatter the old notion that losing parties should cede power gracefully.

[Read: Wisconsin's Scott Walker Signs Bills Stripping Powers From Incoming Governor]

""The political DNA is this country has changed so dramatically that if you're in control, you're going to use it to the utmost and beyond,"" said Kenneth R. Sikkema, a Republican consultant who held leadership positions in both the State Senate and House.

Governor Snyder already has signed other lame-duck bills that have infuriated his critics, including two that contain increases in the minimum-wage and in paid sick leave that the legislature itself had enacted this summer. Republicans passed the bills to shortcut citizen initiatives that would have placed the issues on the November ballot..

Mr. Snyder has not tipped his hand on his views of legislation that would curb his successors' power.

""People should not expect that I'm just going to sign things or I'm just going to veto things,"" he said at an end-of-term news conference last week. ""If I believe it's in the best public-policy interest of the state, I'll sign it, and if it's not, I won't.""

He dodged questions about whether Republicans were being overzealous in their rush to cripple incoming Democrats, but suggested that lack of comity was not confined to his party. ""I think there's a civility issue across the board,"" he said, taking an apparent swipe at the crowds that have jammed the state capitol to protest the legislature's actions. ""One of the ways people are trying to convince me why I should veto bills or be against them is to come yell at me. I'm not sure that I follow the logic of it.""

The governor's depiction of himself as a policy wonk who is above petty politics is vintage Snyder, but it is not without support.

Mr. Snyder is measurably less partisan and conservative than the legislature's Republican majority. He has been comparatively uninvolved in the state Republican Party organization, and refused to endorse Donald J. Trump for president in 2016. This year he even refused to back the Republican candidate for governor, attorney general Bill Schuette, a Trump supporter whose high-profile investigation of the Flint water crisis led to criminal charges against members of Mr. Snyder's administration, including his health secretary.

Mr. Snyder also has rankled Republican lawmakers with vetoes of pet measures large and small, from issuing anti-abortion license plates to allowing concealed firearms in places like day-care centers and sports arenas to an article of partisan Republican faith, stiffening the state's voter ID requirements.

The bills coming to his desk now are no less politically freighted, the product of Republican legislators who moved rightward under Tea Party leadership early this decade, then lurched more sharply to the right after the 2016 election.

Michigan voters seemed to take issue with that in November, electing Democrats to the top three state offices over opponents aligned with Mr. Trump.

They also overwhelmingly approved a trio of ballot initiatives with broad Democratic support. One legalized recreational marijuana use; two others overhauled election laws to make it easier to vote and shifted redistricting authority from the legislature to a new nonpartisan citizens' commission.

To its critics, the legislature is effectively using the lame-duck session to settle scores with both voters who refused to elect Republicans and the Democrats they chose.

One bill passed by the state House targets future ballot initiatives, imposing complex rules on petitions that would make it far harder to collect signatures required to bring an issue before voters.

Other bills place so-called implementing requirements on the citizens' redistricting commission and the new voting measure that the measures' supporters say are unnecessary and potentially harmful.

But it is the proposals to rein in executive powers that have drawn the most attention.

""These guys have never not been in power. They've had all three branches of government the whole time they've been here,"" said James Ananich, a Democratic senator from Flint who is the chamber's minority leader. ""They can't grasp that the things they've been doing, most people don't like, and so there's got to be some way to protect the state from these horrible Democrats.""

Such objections are naïve, say some Republicans.

""Is it partisan? I don't think there's any doubt about that,"" said Robert LaBrant, a Republican strategist, who defended the constitutionality of the measures.

""I wish we could conduct public policy under sterile lab conditions,"" he said. ""But we're probably back to the 1880s as far as extreme partisanship goes.""",https://www.nytimes.com/2018/12/17/us/rick-snyder-bill-whitmer.html
